{
  "admit_date": "2026-05-06",
  "attending_physician": {
    "first_name": "Nicholas",
    "last_name": "Williams",
    "npi": "4118244936"
  },
  "classification": "discharge_summary",
  "diagnosis_codes": [
    "I25.110"
  ],
  "discharge_date": "2026-05-11",
  "discharge_type": "post_cath",
  "discharging_hospital": "UPMC Passavant",
  "document_external_id": "DIS-014",
  "follow_up_window_days": 12,
  "is_degraded": false,
  "medications_changed": [
    {
      "action": "started",
      "name": "Aspirin 81 mg daily"
    },
    {
      "action": "started",
      "name": "Isosorbide mononitrate 30 mg daily"
    },
    {
      "action": "started",
      "name": "Clopidogrel 75 mg daily"
    }
  ],
  "missing_fields": [],
  "patient": {
    "address_line1": "34123 Andrea Estate",
    "city": "Butler",
    "dob": "1966-02-02",
    "external_id": "PAT-020",
    "first_name": "Aaron",
    "last_name": "Hayes",
    "mrn": "MRN-471349",
    "phone": "412-555-1104",
    "state": "PA",
    "zip_code": "16001"
  },
  "primary_diagnosis": "Stable angina s/p PCI to mid-LAD",
  "procedures_performed": [
    {
      "cpt_code": "93458",
      "description": "Coronary angiography with FFR"
    }
  ],
  "recommended_specialist": "Cardiology",
  "urgency_tier": "medium",
  "urgent_flags": [
    "femoral access — bleed precautions",
    "radial access — wrist precautions"
  ]
}
