{
  "admit_date": "2026-04-27",
  "attending_physician": {
    "first_name": "Erin",
    "last_name": "Davis",
    "npi": "8044369956"
  },
  "classification": "discharge_summary",
  "diagnosis_codes": [
    "I48.1"
  ],
  "discharge_date": "2026-05-03",
  "discharge_type": "post_ablation",
  "discharging_hospital": "Heritage Valley Beaver",
  "document_external_id": "DIS-020",
  "follow_up_window_days": 21,
  "is_degraded": false,
  "medications_changed": [
    {
      "action": "adjusted",
      "name": "Metoprolol tartrate 25 mg BID"
    },
    {
      "action": "started",
      "name": "Flecainide 100 mg BID"
    },
    {
      "action": "stopped",
      "name": "Amiodarone"
    },
    {
      "action": "started",
      "name": "Apixaban 5 mg BID"
    }
  ],
  "missing_fields": [],
  "patient": {
    "address_line1": "148 Eric Track",
    "city": "Beaver",
    "dob": "1975-07-14",
    "external_id": "PAT-004",
    "first_name": "Evan",
    "last_name": "Ashley",
    "mrn": "MRN-543039",
    "phone": "878-555-7527",
    "state": "PA",
    "zip_code": "15009"
  },
  "primary_diagnosis": "Atrial flutter s/p cavotricuspid isthmus ablation",
  "procedures_performed": [
    {
      "cpt_code": "93653",
      "description": "Cavotricuspid isthmus ablation"
    }
  ],
  "recommended_specialist": "Cardiology",
  "urgency_tier": "medium",
  "urgent_flags": [
    "post-ablation anticoagulation required"
  ]
}
