{
  "admit_date": "2026-04-23",
  "attending_physician": {
    "first_name": "Shawn",
    "last_name": "Jimenez",
    "npi": "3276483500"
  },
  "classification": "discharge_summary",
  "diagnosis_codes": [
    "I21.A1",
    "I25.10"
  ],
  "discharge_date": "2026-04-26",
  "discharge_type": "post_mi",
  "discharging_hospital": "UPMC Passavant",
  "document_external_id": "DIS-004",
  "follow_up_window_days": 6,
  "is_degraded": false,
  "medications_changed": [
    {
      "action": "started",
      "name": "Metoprolol succinate 50 mg daily"
    },
    {
      "action": "started",
      "name": "Ticagrelor 90 mg BID"
    }
  ],
  "missing_fields": [],
  "patient": {
    "address_line1": "34123 Andrea Estate",
    "city": "Butler",
    "dob": "1966-02-02",
    "external_id": "PAT-020",
    "first_name": "Aaron",
    "last_name": "Hayes",
    "mrn": "MRN-471349",
    "phone": "412-555-1104",
    "state": "PA",
    "zip_code": "16001"
  },
  "primary_diagnosis": "Acute inferior STEMI",
  "procedures_performed": [
    {
      "cpt_code": "93458",
      "description": "Coronary angiography"
    }
  ],
  "recommended_specialist": "Cardiology",
  "urgency_tier": "high",
  "urgent_flags": [
    "post-PCI dual antiplatelet therapy",
    "recent-revascularization",
    "post-acute-MI"
  ]
}
