{
  "admit_date": "2026-05-06",
  "attending_physician": {
    "first_name": "Pamela",
    "last_name": "Boyd",
    "npi": "1733754331"
  },
  "classification": "discharge_summary",
  "diagnosis_codes": [
    "I25.110"
  ],
  "discharge_date": "2026-05-10",
  "discharge_type": "post_cath",
  "discharging_hospital": "AHN Forbes Hospital",
  "document_external_id": "DIS-017",
  "follow_up_window_days": 8,
  "is_degraded": false,
  "medications_changed": [
    {
      "action": "started",
      "name": "Clopidogrel 75 mg daily"
    },
    {
      "action": "started",
      "name": "Isosorbide mononitrate 30 mg daily"
    }
  ],
  "missing_fields": [],
  "patient": {
    "address_line1": "7738 Leon Underpass Apt. 148",
    "city": "Pittsburgh",
    "dob": "1975-01-25",
    "external_id": "PAT-012",
    "first_name": "Elizabeth",
    "last_name": "Harvey",
    "mrn": "MRN-433200",
    "phone": "724-555-9763",
    "state": "PA",
    "zip_code": "15222"
  },
  "primary_diagnosis": "Mild CAD on diagnostic angiography",
  "procedures_performed": [
    {
      "cpt_code": "93458",
      "description": "Coronary angiography"
    }
  ],
  "recommended_specialist": "Cardiology",
  "urgency_tier": "medium",
  "urgent_flags": [
    "radial access — wrist precautions",
    "post-PCI dual antiplatelet therapy",
    "femoral access — bleed precautions"
  ]
}
